-- create_drop.sql : non regression tests for Distributed E-Maj objects creation and drop.
-- It tests in particular:
--   Dist_emaj_create_database(), dist_emaj_drop_database(),
--   Dist_emaj_create_cluster(), dist_emaj_drop_cluster(),
--   Dist_emaj_assign_group(), dist_emaj_remove_group(),
--   Dist_emaj_export_clusters_configuration(), dist_emaj_import_clusters_configuration().
--
-- Prepare the test context.
--
-- Set sequence restart value.
SELECT public.handle_dist_emaj_sequences(1000);
 handle_dist_emaj_sequences 
----------------------------
 
(1 row)

-- Define and create the temp file directory to be used by the script.
\setenv EMAJTESTTMPDIR '/tmp/emaj_'`echo $PGVER`'/create_drop'
\set EMAJTESTTMPDIR `echo $EMAJTESTTMPDIR`
\! mkdir -p $EMAJTESTTMPDIR
--
-- Test dist_emaj_create_database().
--
-- Illegal value.
SELECT dist_emaj.dist_emaj_create_database(NULL, 'a connect string', 2);
ERROR:  dist_emaj_create_database: The database name can't be NULL or empty.
CONTEXT:  PL/pgSQL function dist_emaj.dist_emaj_create_database(text,text,integer,boolean) line 18 at RAISE
SELECT dist_emaj.dist_emaj_create_database('first_database', NULL, 2);
ERROR:  dist_emaj_create_database: The connect string can't be NULL.
CONTEXT:  PL/pgSQL function dist_emaj.dist_emaj_create_database(text,text,integer,boolean) line 22 at RAISE
SELECT dist_emaj.dist_emaj_create_database('first_database', 'a connect string', NULL);
ERROR:  dist_emaj_create_database: The number of rollback parallel sessions must be greater than 0.
CONTEXT:  PL/pgSQL function dist_emaj.dist_emaj_create_database(text,text,integer,boolean) line 26 at RAISE
SELECT dist_emaj.dist_emaj_create_database('first_database', 'a connect string', 0);
ERROR:  dist_emaj_create_database: The number of rollback parallel sessions must be greater than 0.
CONTEXT:  PL/pgSQL function dist_emaj.dist_emaj_create_database(text,text,integer,boolean) line 26 at RAISE
-- Ok.
SELECT dist_emaj.dist_emaj_create_database('first_database', 'a connect string', 2);
 dist_emaj_create_database 
---------------------------
                         1
(1 row)

SELECT * FROM dist_emaj.dist_emaj_database WHERE db_name = 'first_database';
    db_name     | db_connect_string | db_rlbk_parallel_session | db_creation_time_id | db_last_alter_time_id 
----------------+-------------------+--------------------------+---------------------+-----------------------
 first_database | a connect string  |                        2 |                1000 |                      
(1 row)

-- Already created.
SELECT dist_emaj.dist_emaj_create_database('first_database', 'another connect string', 3);
ERROR:  dist_emaj_create_database: The database "first_database" already exists.
CONTEXT:  PL/pgSQL function dist_emaj.dist_emaj_create_database(text,text,integer,boolean) line 36 at RAISE
SELECT dist_emaj.dist_emaj_create_database('first_database', 'another connect string', 3, TRUE);
 dist_emaj_create_database 
---------------------------
                         0
(1 row)

SELECT * FROM dist_emaj.dist_emaj_database WHERE db_name = 'first_database';
    db_name     |   db_connect_string    | db_rlbk_parallel_session | db_creation_time_id | db_last_alter_time_id 
----------------+------------------------+--------------------------+---------------------+-----------------------
 first_database | another connect string |                        3 |                1000 |                  1001
(1 row)

--
-- Test dist_emaj_drop_database().
--
-- Database does not exist.
SELECT dist_emaj.dist_emaj_drop_database('dummy_database');
ERROR:  dist_emaj_drop_database: The database "dummy_database" does not exist.
CONTEXT:  PL/pgSQL function dist_emaj.dist_emaj_drop_database(text,boolean,boolean) line 22 at RAISE
SELECT dist_emaj.dist_emaj_drop_database('dummy_database', TRUE);
 dist_emaj_drop_database 
-------------------------
                       0
(1 row)

-- An assigned group.
INSERT INTO dist_emaj.dist_emaj_cluster (clst_name) VALUES ('a_cluster');
INSERT INTO dist_emaj.dist_emaj_cluster_group VALUES ('a_cluster', 'first_database', 'a group');
-- But CASCADE is not allowed.
SELECT dist_emaj.dist_emaj_drop_database('first_database');
ERROR:  dist_emaj_drop_database: The database "first_database" has 1 groups assigned to existing clusters.
CONTEXT:  PL/pgSQL function dist_emaj.dist_emaj_drop_database(text,boolean,boolean) line 37 at RAISE
-- Ok, CASCADE is now allowed.
SELECT dist_emaj.dist_emaj_drop_database('first_database', FALSE, TRUE);
 dist_emaj_drop_database 
-------------------------
                       1
(1 row)

DELETE FROM dist_emaj.dist_emaj_cluster WHERE clst_name = 'a_cluster';
--
-- Test dist_emaj_create_cluster().
--
-- Illegal value.
SELECT dist_emaj.dist_emaj_create_cluster(NULL);
ERROR:  dist_emaj_create_cluster: The cluster name can't be NULL or empty.
CONTEXT:  PL/pgSQL function dist_emaj.dist_emaj_create_cluster(text,boolean) line 15 at RAISE
-- Ok.
SELECT dist_emaj.dist_emaj_create_cluster('first_cluster');
 dist_emaj_create_cluster 
--------------------------
                        1
(1 row)

-- Already created.
SELECT dist_emaj.dist_emaj_create_cluster('first_cluster');
ERROR:  dist_emaj_create_cluster: The cluster "first_cluster" already exists.
CONTEXT:  PL/pgSQL function dist_emaj.dist_emaj_create_cluster(text,boolean) line 21 at RAISE
SELECT dist_emaj.dist_emaj_create_cluster('first_cluster', TRUE);
 dist_emaj_create_cluster 
--------------------------
                        0
(1 row)

--
-- Test dist_emaj_drop_cluster().
--
-- Cluster does not exist.
SELECT dist_emaj.dist_emaj_drop_cluster('dummy_cluster');
ERROR:  dist_emaj_drop_cluster: The cluster "dummy_cluster" does not exist.
CONTEXT:  PL/pgSQL function dist_emaj.dist_emaj_drop_cluster(text,boolean,boolean) line 18 at RAISE
SELECT dist_emaj.dist_emaj_drop_cluster('dummy_cluster', TRUE);
 dist_emaj_drop_cluster 
------------------------
                      0
(1 row)

-- An assigned group.
INSERT INTO dist_emaj.dist_emaj_database (db_name, db_connect_string, db_rlbk_parallel_session) VALUES ('a_database', 'a connect string', 1);
INSERT INTO dist_emaj.dist_emaj_cluster_group VALUES ('first_cluster', 'a_database', 'a group');
-- But CASCADE is not allowed.
SELECT dist_emaj.dist_emaj_drop_cluster('first_cluster');
ERROR:  dist_emaj_drop_cluster: The cluster "first_cluster" has 1 groups assigned to it.
CONTEXT:  PL/pgSQL function dist_emaj.dist_emaj_drop_cluster(text,boolean,boolean) line 33 at RAISE
-- Ok, CASCADE is now allowed.
SELECT dist_emaj.dist_emaj_drop_cluster('first_cluster', FALSE, TRUE);
 dist_emaj_drop_cluster 
------------------------
                      1
(1 row)

DELETE FROM dist_emaj.dist_emaj_database WHERE db_name = 'a_database';
--
-- Test dist_emaj_assign_group().
--
INSERT INTO dist_emaj.dist_emaj_cluster (clst_name) VALUES ('a_cluster');
INSERT INTO dist_emaj.dist_emaj_database (db_name, db_connect_string, db_rlbk_parallel_session) VALUES ('a_database', 'a connect string', 1);
-- Invalid values.
SELECT dist_emaj.dist_emaj_assign_group('dummy_cluster', 'dummy_database', 'dummy_group');
ERROR:  dist_emaj_assign_group: The cluster "dummy_cluster" does not exist.
CONTEXT:  PL/pgSQL function dist_emaj.dist_emaj_assign_group(text,text,text,boolean) line 15 at RAISE
SELECT dist_emaj.dist_emaj_assign_group('a_cluster', 'dummy_database', 'dummy_group');
ERROR:  dist_emaj_assign_group: The database "dummy_database" does not exist.
CONTEXT:  PL/pgSQL function dist_emaj.dist_emaj_assign_group(text,text,text,boolean) line 22 at RAISE
-- Ok.
SELECT dist_emaj.dist_emaj_assign_group('a_cluster', 'a_database', 'a_group');
 dist_emaj_assign_group 
------------------------
                      1
(1 row)

-- Already assigned.
SELECT dist_emaj.dist_emaj_assign_group('a_cluster', 'a_database', 'a_group');
ERROR:  dist_emaj_assign_group: The table group "a_group" on database "a_database" is already assigned to the cluster "a_cluster".
CONTEXT:  PL/pgSQL function dist_emaj.dist_emaj_assign_group(text,text,text,boolean) line 34 at RAISE
SELECT dist_emaj.dist_emaj_assign_group('a_cluster', 'a_database', 'a_group', TRUE);
 dist_emaj_assign_group 
------------------------
                      0
(1 row)

--
-- Test dist_emaj_remove_group().
--
-- Invalid values.
SELECT dist_emaj.dist_emaj_remove_group('dummy_cluster', 'dummy_database', 'dummy_group');
ERROR:  dist_emaj_remove_group: The cluster "dummy_cluster" does not exist.
CONTEXT:  PL/pgSQL function dist_emaj.dist_emaj_remove_group(text,text,text,boolean) line 15 at RAISE
SELECT dist_emaj.dist_emaj_remove_group('a_cluster', 'dummy_database', 'dummy_group');
ERROR:  dist_emaj_remove_group: The database "dummy_database" does not exist.
CONTEXT:  PL/pgSQL function dist_emaj.dist_emaj_remove_group(text,text,text,boolean) line 22 at RAISE
-- Ok.
SELECT dist_emaj.dist_emaj_remove_group('a_cluster', 'a_database', 'a_group');
 dist_emaj_remove_group 
------------------------
                      1
(1 row)

-- Not assigned group.
SELECT dist_emaj.dist_emaj_remove_group('a_cluster', 'a_database', 'a_group');
ERROR:  dist_emaj_remove_group: The table group "a_group" on database "a_database" is not currently assigned to the cluster "a_cluster".
CONTEXT:  PL/pgSQL function dist_emaj.dist_emaj_remove_group(text,text,text,boolean) line 34 at RAISE
SELECT dist_emaj.dist_emaj_remove_group('a_cluster', 'a_database', 'a_group', TRUE);
 dist_emaj_remove_group 
------------------------
                      0
(1 row)

DELETE FROM dist_emaj.dist_emaj_database WHERE db_name = 'a_database';
DELETE FROM dist_emaj.dist_emaj_cluster WHERE clst_name = 'a_cluster';
--
-- Prepare the clusters configuration for the next script.
--
SELECT dist_emaj.dist_emaj_create_database('emaj_1', 'host=localhost port=' || pg_catalog.current_setting('port') || ' dbname=regression_1 user=_regress_emaj_adm password=adm', 2);
 dist_emaj_create_database 
---------------------------
                         1
(1 row)

SELECT dist_emaj.dist_emaj_create_database('emaj_2', 'postgresql://_regress_emaj_adm:adm@localhost:' || pg_catalog.current_setting('port') || '/regression_2', 2);
 dist_emaj_create_database 
---------------------------
                         1
(1 row)

SELECT dist_emaj.dist_emaj_create_cluster('my_cluster');
 dist_emaj_create_cluster 
--------------------------
                        1
(1 row)

SELECT dist_emaj.dist_emaj_create_cluster('empty_cluster');
 dist_emaj_create_cluster 
--------------------------
                        1
(1 row)

SELECT dist_emaj.dist_emaj_assign_group('my_cluster', 'emaj_1', 'myGroup1');
 dist_emaj_assign_group 
------------------------
                      1
(1 row)

SELECT dist_emaj.dist_emaj_assign_group('my_cluster', 'emaj_1', 'myGroup2');
 dist_emaj_assign_group 
------------------------
                      1
(1 row)

SELECT dist_emaj.dist_emaj_assign_group('my_cluster', 'emaj_2', 'phil''s group#3",');
 dist_emaj_assign_group 
------------------------
                      1
(1 row)

SELECT dist_emaj.dist_emaj_assign_group('my_cluster', 'emaj_2', 'myGroup4');
 dist_emaj_assign_group 
------------------------
                      1
(1 row)

SELECT dist_emaj.dist_emaj_assign_group('my_cluster', 'emaj_2', 'myGroup5');
 dist_emaj_assign_group 
------------------------
                      1
(1 row)

SELECT dist_emaj.dist_emaj_assign_group('my_cluster', 'emaj_2', 'myGroup6');
 dist_emaj_assign_group 
------------------------
                      1
(1 row)

--
-- Test dist_emaj_verify_cluster.
-- (Note that the distributed rollback states cleanup is tested in the rollback.sql script).
--
-- Unknown cluster.
SELECT dist_emaj.dist_emaj_verify_cluster('dummy');
ERROR:  dist_emaj_verify_cluster: The cluster "dummy" is unknown.
CONTEXT:  PL/pgSQL function dist_emaj.dist_emaj_verify_cluster(text,boolean) line 20 at RAISE
-- Empty cluster.
SELECT dist_emaj.dist_emaj_verify_cluster('empty_cluster');
 dist_emaj_verify_cluster 
--------------------------
 
(1 row)

SELECT dist_emaj.dist_emaj_verify_cluster('empty_cluster', TRUE);
ERROR:  dist_emaj_verify_cluster: The cluster "empty_cluster" is empty.
CONTEXT:  PL/pgSQL function dist_emaj.dist_emaj_verify_cluster(text,boolean) line 28 at RAISE
-- emaj is missing in a database.
CREATE DATABASE regression_no_emaj;
SELECT dist_emaj.dist_emaj_create_database('no_emaj', 'host=localhost port=' || pg_catalog.current_setting('port') || ' dbname=regression_no_emaj user=_regress_emaj_adm password=adm', 1);
 dist_emaj_create_database 
---------------------------
                         1
(1 row)

BEGIN;
  SELECT dist_emaj.dist_emaj_create_cluster('buggy_cluster');
 dist_emaj_create_cluster 
--------------------------
                        1
(1 row)

  SELECT dist_emaj.dist_emaj_assign_group('buggy_cluster', 'no_emaj', 'myGroup1');
 dist_emaj_assign_group 
------------------------
                      1
(1 row)

  SELECT dist_emaj.dist_emaj_verify_cluster('buggy_cluster');
ERROR:  _verify_database (2): Error on database "no_emaj", the emaj extension is not installed in the database.
CONTEXT:  PL/pgSQL function dist_emaj._verify_database(text,text,text,text,boolean) line 54 at RAISE
SQL statement "SELECT dist_emaj._verify_database(db_name, db_connect_string, groups_list, v_dblinkSchema, TRUE)
      FROM (
        SELECT db_name, db_connect_string,
               string_agg(quote_literal(clgrp_group), ',' ORDER BY clgrp_group) AS groups_list
          FROM dist_emaj.dist_emaj_cluster_group
               JOIN dist_emaj.dist_emaj_database ON (dist_emaj_database.db_name = dist_emaj_cluster_group.clgrp_database)
          WHERE clgrp_cluster = p_cluster
          GROUP BY db_name, db_connect_string
          ORDER BY db_name
        ) AS databases"
PL/pgSQL function dist_emaj.dist_emaj_verify_cluster(text,boolean) line 38 at PERFORM
ROLLBACK;
-- Keep the database and the database for dist_emaj_verify_all() tests in misc.sql.
-- Should be OK.
SELECT dist_emaj.dist_emaj_verify_cluster('my_cluster');
 dist_emaj_verify_cluster 
--------------------------
 
(1 row)

--
-- Check dist_emaj tables content.
--
SELECT hist_id, hist_function, hist_event, hist_object, regexp_replace(hist_wording, E'\\d\\d\.\\d\\d\\.\\d\\d\\.\\d\\d\\d\\d', '%', 'g'), hist_user
  FROM dist_emaj.dist_emaj_hist WHERE hist_id >= 1000 ORDER BY 1;
 hist_id |  hist_function  |   hist_event   |       hist_object       |                regexp_replace                 | hist_user 
---------+-----------------+----------------+-------------------------+-----------------------------------------------+-----------
    1004 | CREATE_DATABASE | BEGIN          | first_database          |                                               | postgres
    1005 | CREATE_DATABASE | TIME STAMP SET | 1000                    |                                               | postgres
    1006 | CREATE_DATABASE | END            | first_database          | Database created                              | postgres
    1008 | CREATE_DATABASE | BEGIN          | first_database          |                                               | postgres
    1009 | CREATE_DATABASE | TIME STAMP SET | 1001                    |                                               | postgres
    1010 | CREATE_DATABASE | END            | first_database          | Database modified                             | postgres
    1012 | DROP_DATABASE   | BEGIN          | dummy_database          |                                               | postgres
    1013 | DROP_DATABASE   | END            | dummy_database          | The database did not exist                    | postgres
    1016 | DROP_DATABASE   | BEGIN          | first_database          |                                               | postgres
    1017 | DROP_DATABASE   | TIME STAMP SET | 1003                    |                                               | postgres
    1018 | DROP_DATABASE   | END            | first_database          | Database dropped, 1 group assignments deleted | postgres
    1020 | CREATE_CLUSTER  | BEGIN          | first_cluster           |                                               | postgres
    1021 | CREATE_CLUSTER  | TIME STAMP SET | 1004                    |                                               | postgres
    1022 | CREATE_CLUSTER  | END            | first_cluster           | Cluster created                               | postgres
    1024 | CREATE_CLUSTER  | BEGIN          | first_cluster           |                                               | postgres
    1025 | CREATE_CLUSTER  | END            | first_cluster           | The cluster already existed                   | postgres
    1027 | DROP_CLUSTER    | BEGIN          | dummy_cluster           |                                               | postgres
    1028 | DROP_CLUSTER    | END            | dummy_cluster           | The cluster did not exist                     | postgres
    1031 | DROP_CLUSTER    | BEGIN          | first_cluster           |                                               | postgres
    1032 | DROP_CLUSTER    | TIME STAMP SET | 1006                    |                                               | postgres
    1033 | DROP_CLUSTER    | END            | first_cluster           | Cluster dropped, 1 group assignments deleted  | postgres
    1036 | ASSIGN_GROUP    | BEGIN          | a_database.a_group      | To cluster a_cluster                          | postgres
    1037 | ASSIGN_GROUP    | TIME STAMP SET | 1007                    |                                               | postgres
    1038 | ASSIGN_GROUP    | END            | a_database.a_group      | Group assigned to the cluster                 | postgres
    1040 | ASSIGN_GROUP    | BEGIN          | a_database.a_group      | To cluster a_cluster                          | postgres
    1041 | ASSIGN_GROUP    | END            | a_database.a_group      | The group was already assigned to the cluster | postgres
    1044 | REMOVE_GROUP    | BEGIN          | a_database.a_group      | From cluster a_cluster                        | postgres
    1045 | REMOVE_GROUP    | TIME STAMP SET | 1008                    |                                               | postgres
    1046 | REMOVE_GROUP    | END            | a_database.a_group      | Group removed from the cluster                | postgres
    1048 | REMOVE_GROUP    | BEGIN          | a_database.a_group      | From cluster a_cluster                        | postgres
    1049 | REMOVE_GROUP    | END            | a_database.a_group      | The group was not assigned to the cluster     | postgres
    1050 | CREATE_DATABASE | BEGIN          | emaj_1                  |                                               | postgres
    1051 | CREATE_DATABASE | TIME STAMP SET | 1009                    |                                               | postgres
    1052 | CREATE_DATABASE | END            | emaj_1                  | Database created                              | postgres
    1053 | CREATE_DATABASE | BEGIN          | emaj_2                  |                                               | postgres
    1054 | CREATE_DATABASE | TIME STAMP SET | 1010                    |                                               | postgres
    1055 | CREATE_DATABASE | END            | emaj_2                  | Database created                              | postgres
    1056 | CREATE_CLUSTER  | BEGIN          | my_cluster              |                                               | postgres
    1057 | CREATE_CLUSTER  | TIME STAMP SET | 1011                    |                                               | postgres
    1058 | CREATE_CLUSTER  | END            | my_cluster              | Cluster created                               | postgres
    1059 | CREATE_CLUSTER  | BEGIN          | empty_cluster           |                                               | postgres
    1060 | CREATE_CLUSTER  | TIME STAMP SET | 1012                    |                                               | postgres
    1061 | CREATE_CLUSTER  | END            | empty_cluster           | Cluster created                               | postgres
    1062 | ASSIGN_GROUP    | BEGIN          | emaj_1.myGroup1         | To cluster my_cluster                         | postgres
    1063 | ASSIGN_GROUP    | TIME STAMP SET | 1013                    |                                               | postgres
    1064 | ASSIGN_GROUP    | END            | emaj_1.myGroup1         | Group assigned to the cluster                 | postgres
    1065 | ASSIGN_GROUP    | BEGIN          | emaj_1.myGroup2         | To cluster my_cluster                         | postgres
    1066 | ASSIGN_GROUP    | TIME STAMP SET | 1014                    |                                               | postgres
    1067 | ASSIGN_GROUP    | END            | emaj_1.myGroup2         | Group assigned to the cluster                 | postgres
    1068 | ASSIGN_GROUP    | BEGIN          | emaj_2.phil's group#3", | To cluster my_cluster                         | postgres
    1069 | ASSIGN_GROUP    | TIME STAMP SET | 1015                    |                                               | postgres
    1070 | ASSIGN_GROUP    | END            | emaj_2.phil's group#3", | Group assigned to the cluster                 | postgres
    1071 | ASSIGN_GROUP    | BEGIN          | emaj_2.myGroup4         | To cluster my_cluster                         | postgres
    1072 | ASSIGN_GROUP    | TIME STAMP SET | 1016                    |                                               | postgres
    1073 | ASSIGN_GROUP    | END            | emaj_2.myGroup4         | Group assigned to the cluster                 | postgres
    1074 | ASSIGN_GROUP    | BEGIN          | emaj_2.myGroup5         | To cluster my_cluster                         | postgres
    1075 | ASSIGN_GROUP    | TIME STAMP SET | 1017                    |                                               | postgres
    1076 | ASSIGN_GROUP    | END            | emaj_2.myGroup5         | Group assigned to the cluster                 | postgres
    1077 | ASSIGN_GROUP    | BEGIN          | emaj_2.myGroup6         | To cluster my_cluster                         | postgres
    1078 | ASSIGN_GROUP    | TIME STAMP SET | 1018                    |                                               | postgres
    1079 | ASSIGN_GROUP    | END            | emaj_2.myGroup6         | Group assigned to the cluster                 | postgres
    1080 | CREATE_DATABASE | BEGIN          | no_emaj                 |                                               | postgres
    1081 | CREATE_DATABASE | TIME STAMP SET | 1019                    |                                               | postgres
    1082 | CREATE_DATABASE | END            | no_emaj                 | Database created                              | postgres
(64 rows)

SELECT * FROM dist_emaj.dist_emaj_cluster ORDER BY 1;
   clst_name   | clst_creation_time_id | clst_last_alter_time_id 
---------------+-----------------------+-------------------------
 empty_cluster |                  1012 |                        
 my_cluster    |                  1011 |                    1018
(2 rows)

SELECT * FROM dist_emaj.dist_emaj_database ORDER BY 1;
 db_name |                                   db_connect_string                                    | db_rlbk_parallel_session | db_creation_time_id | db_last_alter_time_id 
---------+----------------------------------------------------------------------------------------+--------------------------+---------------------+-----------------------
 emaj_1  | host=localhost port=5414 dbname=regression_1 user=_regress_emaj_adm password=adm       |                        2 |                1009 |                      
 emaj_2  | postgresql://_regress_emaj_adm:adm@localhost:5414/regression_2                         |                        2 |                1010 |                      
 no_emaj | host=localhost port=5414 dbname=regression_no_emaj user=_regress_emaj_adm password=adm |                        1 |                1019 |                      
(3 rows)

SELECT * FROM dist_emaj.dist_emaj_cluster_group ORDER BY 1,2,3;
 clgrp_cluster | clgrp_database |   clgrp_group    | clgrp_last_assign_time_id 
---------------+----------------+------------------+---------------------------
 my_cluster    | emaj_1         | myGroup1         |                      1013
 my_cluster    | emaj_1         | myGroup2         |                      1014
 my_cluster    | emaj_2         | myGroup4         |                      1016
 my_cluster    | emaj_2         | myGroup5         |                      1017
 my_cluster    | emaj_2         | myGroup6         |                      1018
 my_cluster    | emaj_2         | phil's group#3", |                      1015
(6 rows)

-----------------------------
-- Dist_emaj_export_clusters_configuration() and dist_emaj_import_clusters_configuration() tests.
-----------------------------
--
-- Direct export.
--
--   Bad selected clusters array.
SELECT dist_emaj.dist_emaj_export_clusters_configuration(ARRAY['my_cluster', 'unknown1', 'unknown2']);
ERROR:  _export_clusters_conf: The clusters unknown1, unknown2 are unknown.
CONTEXT:  PL/pgSQL function dist_emaj._export_clusters_conf(text[]) line 32 at RAISE
PL/pgSQL function dist_emaj.dist_emaj_export_clusters_configuration(text[]) line 8 at RETURN
-- Ok.
SELECT json_array_length(dist_emaj.dist_emaj_export_clusters_configuration()->'clusters');
 json_array_length 
-------------------
                 2
(1 row)

SELECT json_array_length(dist_emaj.dist_emaj_export_clusters_configuration()->'databases');
 json_array_length 
-------------------
                 3
(1 row)

SELECT json_array_length(dist_emaj.dist_emaj_export_clusters_configuration(ARRAY['my_cluster', 'empty_cluster'])->'clusters');
 json_array_length 
-------------------
                 2
(1 row)

--
-- Export to a file.
--
--   Error.
SELECT dist_emaj.dist_emaj_export_clusters_configuration('/tmp/dummy/location/file');
ERROR:  could not open file "/tmp/dummy/location/file" for writing: No such file or directory
HINT:  COPY TO instructs the PostgreSQL server process to write a file. You may want a client-side facility such as psql's \copy.
CONTEXT:  SQL statement "COPY t TO '/tmp/dummy/location/file'"
PL/pgSQL function dist_emaj.dist_emaj_export_clusters_configuration(text,text[]) line 17 at EXECUTE
--   Ok.
SELECT dist_emaj.dist_emaj_export_clusters_configuration(:'EMAJTESTTMPDIR' || '/orig_clusters_config_all.JSON');
 dist_emaj_export_clusters_configuration 
-----------------------------------------
                                       2
(1 row)

SELECT dist_emaj.dist_emaj_export_clusters_configuration(:'EMAJTESTTMPDIR' || '/orig_clusters_config_partial.JSON', ARRAY['my_cluster']);
 dist_emaj_export_clusters_configuration 
-----------------------------------------
                                       1
(1 row)

\! wc -l $EMAJTESTTMPDIR/*.json
wc: '/tmp/emaj_14/create_drop/*.json': No such file or directory
\! grep -v ', at ' $EMAJTESTTMPDIR/orig_clusters_config_all.json
grep: /tmp/emaj_14/create_drop/orig_clusters_config_all.json: No such file or directory
--
-- Direct import.
--
--   Bad content.
SELECT dist_emaj.dist_emaj_import_clusters_configuration('{ "dummy_json": NULL }'::JSON);
ERROR:  invalid input syntax for type json
LINE 1: ...dist_emaj.dist_emaj_import_clusters_configuration('{ "dummy_...
                                                             ^
DETAIL:  Token "NULL" is invalid.
CONTEXT:  JSON data, line 1: { "dummy_json": NULL...
-- Databases checks.
--   Missing or null "database" attribute.
SELECT dist_emaj.dist_emaj_import_clusters_configuration('{ "databases": [ { "unknown_attr1": NULL } ] }'::JSON);
ERROR:  invalid input syntax for type json
LINE 1: ...dist_emaj.dist_emaj_import_clusters_configuration('{ "databa...
                                                             ^
DETAIL:  Token "NULL" is invalid.
CONTEXT:  JSON data, line 1: { "databases": [ { "unknown_attr1": NULL...
SELECT dist_emaj.dist_emaj_import_clusters_configuration('{ "databases": [ { "database": NULL } ] }'::JSON);
ERROR:  invalid input syntax for type json
LINE 1: ...dist_emaj.dist_emaj_import_clusters_configuration('{ "databa...
                                                             ^
DETAIL:  Token "NULL" is invalid.
CONTEXT:  JSON data, line 1: { "databases": [ { "database": NULL...
--   Unknown and missing attributes.
SELECT dist_emaj.dist_emaj_import_clusters_configuration('{ "databases": [ { "database": "db1", "unknown1": 1, "unknown2": 2 } ] }'::JSON);
WARNING:  _import_clusters_conf (1): For the database "db1", the keyword "unknown1" is unknown.
WARNING:  _import_clusters_conf (1): For the database "db1", the keyword "unknown2" is unknown.
WARNING:  _import_clusters_conf (1): For the database "db1", the "connect_string" attribute must exist and be of type string.
WARNING:  _import_clusters_conf (1): For the database "db1", the "rollback_parallel_sessions" attribute must exist and be of type number.
ERROR:  _import_clusters_conf: One or several errors have been detected in the supplied JSON structure.
CONTEXT:  PL/pgSQL function dist_emaj._import_clusters_conf(json,text[],text[],boolean,boolean,text) line 56 at RAISE
PL/pgSQL function dist_emaj.dist_emaj_import_clusters_configuration(json,text[],text[],boolean,boolean) line 16 at RETURN
--   Null "connect_string" attribute.
SELECT dist_emaj.dist_emaj_import_clusters_configuration('{ "databases": [ { "database": "db1", "connect_string": NULL, "rollback_parallel_sessions": 1 } ] }'::JSON);
ERROR:  invalid input syntax for type json
LINE 1: ...dist_emaj.dist_emaj_import_clusters_configuration('{ "databa...
                                                             ^
DETAIL:  Token "NULL" is invalid.
CONTEXT:  JSON data, line 1: ...s": [ { "database": "db1", "connect_string": NULL...
--   Null or not numeric "rollback_parallel_sessions" attribute.
SELECT dist_emaj.dist_emaj_import_clusters_configuration('{ "databases": [ { "database": "db1", "connect_string": "cnx1", "rollback_parallel_sessions": NULL} ] }'::JSON);
ERROR:  invalid input syntax for type json
LINE 1: ...dist_emaj.dist_emaj_import_clusters_configuration('{ "databa...
                                                             ^
DETAIL:  Token "NULL" is invalid.
CONTEXT:  JSON data, line 1: ...ring": "cnx1", "rollback_parallel_sessions": NULL...
SELECT dist_emaj.dist_emaj_import_clusters_configuration('{ "databases": [ { "database": "db1", "connect_string": "cnx1", "rollback_parallel_sessions": "?"} ] }'::JSON);
WARNING:  _import_clusters_conf (1): For the database "db1", the "rollback_parallel_sessions" attribute must exist and be of type number.
ERROR:  _import_clusters_conf: One or several errors have been detected in the supplied JSON structure.
CONTEXT:  PL/pgSQL function dist_emaj._import_clusters_conf(json,text[],text[],boolean,boolean,text) line 56 at RAISE
PL/pgSQL function dist_emaj.dist_emaj_import_clusters_configuration(json,text[],text[],boolean,boolean) line 16 at RETURN
-- Clusters checks.
--   Missing or null "cluster" attribute.
SELECT dist_emaj.dist_emaj_import_clusters_configuration('{ "clusters": [ {  } ]}'::JSON);
WARNING:  _import_clusters_conf (1): The cluster #1 has no valid "cluster" attribute.
ERROR:  _import_clusters_conf: One or several errors have been detected in the supplied JSON structure.
CONTEXT:  PL/pgSQL function dist_emaj._import_clusters_conf(json,text[],text[],boolean,boolean,text) line 56 at RAISE
PL/pgSQL function dist_emaj.dist_emaj_import_clusters_configuration(json,text[],text[],boolean,boolean) line 16 at RETURN
SELECT dist_emaj.dist_emaj_import_clusters_configuration('{ "clusters": [ { "cluster": NULL } ]}'::JSON);
ERROR:  invalid input syntax for type json
LINE 1: ...dist_emaj.dist_emaj_import_clusters_configuration('{ "cluste...
                                                             ^
DETAIL:  Token "NULL" is invalid.
CONTEXT:  JSON data, line 1: { "clusters": [ { "cluster": NULL...
--   Unknown attributes.
SELECT dist_emaj.dist_emaj_import_clusters_configuration('{ "clusters": [ { "cluster": "clst1", "unknown1": 1, "unknown2": 2 } ]}'::JSON);
WARNING:  _import_clusters_conf (1): For the cluster "clst1", the keyword "unknown1" is unknown.
WARNING:  _import_clusters_conf (1): For the cluster "clst1", the keyword "unknown2" is unknown.
WARNING:  _import_clusters_conf (1): For the cluster "clst1", the "groups" attribute must exist and be of type array.
ERROR:  _import_clusters_conf: One or several errors have been detected in the supplied JSON structure.
CONTEXT:  PL/pgSQL function dist_emaj._import_clusters_conf(json,text[],text[],boolean,boolean,text) line 56 at RAISE
PL/pgSQL function dist_emaj.dist_emaj_import_clusters_configuration(json,text[],text[],boolean,boolean) line 16 at RETURN
--   Missing or invalid "group" attribute.
SELECT dist_emaj.dist_emaj_import_clusters_configuration('{ "clusters": [ { "cluster": "clst1" } ]}'::JSON);
WARNING:  _import_clusters_conf (1): For the cluster "clst1", the "groups" attribute must exist and be of type array.
ERROR:  _import_clusters_conf: One or several errors have been detected in the supplied JSON structure.
CONTEXT:  PL/pgSQL function dist_emaj._import_clusters_conf(json,text[],text[],boolean,boolean,text) line 56 at RAISE
PL/pgSQL function dist_emaj.dist_emaj_import_clusters_configuration(json,text[],text[],boolean,boolean) line 16 at RETURN
SELECT dist_emaj.dist_emaj_import_clusters_configuration('{ "clusters": [ { "cluster": "clst1", "groups": "???" } ]}'::JSON);
WARNING:  _import_clusters_conf (1): For the cluster "clst1", the "groups" attribute must exist and be of type array.
ERROR:  _import_clusters_conf: One or several errors have been detected in the supplied JSON structure.
CONTEXT:  PL/pgSQL function dist_emaj._import_clusters_conf(json,text[],text[],boolean,boolean,text) line 56 at RAISE
PL/pgSQL function dist_emaj.dist_emaj_import_clusters_configuration(json,text[],text[],boolean,boolean) line 16 at RETURN
--   In group, missing "database" or "group" attributes or invalid attributes.
SELECT dist_emaj.dist_emaj_import_clusters_configuration('{ "clusters": [ { "cluster": "clst1", "groups": [ { } ] } ]}'::JSON);
WARNING:  _import_clusters_conf (1): In the cluster "clst1", the group #1 has no "database" attribute.
WARNING:  _import_clusters_conf (1): In the cluster "clst1", the group #1 has no "group" attribute.
ERROR:  _import_clusters_conf: One or several errors have been detected in the supplied JSON structure.
CONTEXT:  PL/pgSQL function dist_emaj._import_clusters_conf(json,text[],text[],boolean,boolean,text) line 56 at RAISE
PL/pgSQL function dist_emaj.dist_emaj_import_clusters_configuration(json,text[],text[],boolean,boolean) line 16 at RETURN
SELECT dist_emaj.dist_emaj_import_clusters_configuration('{ "clusters": [ { "cluster": "clst1", "groups": [ { "database": "ssss"} ] } ]}'::JSON);
WARNING:  _import_clusters_conf (1): In the cluster "clst1", the group #1 has no "group" attribute.
ERROR:  _import_clusters_conf: One or several errors have been detected in the supplied JSON structure.
CONTEXT:  PL/pgSQL function dist_emaj._import_clusters_conf(json,text[],text[],boolean,boolean,text) line 56 at RAISE
PL/pgSQL function dist_emaj.dist_emaj_import_clusters_configuration(json,text[],text[],boolean,boolean) line 16 at RETURN
SELECT dist_emaj.dist_emaj_import_clusters_configuration('{ "clusters": [ { "cluster": "clst1", "groups": [ { "group": "gggg"} ] } ]}'::JSON);
WARNING:  _import_clusters_conf (1): In the cluster "clst1", the group #1 has no "database" attribute.
ERROR:  _import_clusters_conf: One or several errors have been detected in the supplied JSON structure.
CONTEXT:  PL/pgSQL function dist_emaj._import_clusters_conf(json,text[],text[],boolean,boolean,text) line 56 at RAISE
PL/pgSQL function dist_emaj.dist_emaj_import_clusters_configuration(json,text[],text[],boolean,boolean) line 16 at RETURN
SELECT dist_emaj.dist_emaj_import_clusters_configuration('{ "clusters": [ { "cluster": "clst1", "groups": [ { "database": "", "group": NULL, "unknown_attr1": NULL} ] } ]}'::JSON);
ERROR:  invalid input syntax for type json
LINE 1: ...dist_emaj.dist_emaj_import_clusters_configuration('{ "cluste...
                                                             ^
DETAIL:  Token "NULL" is invalid.
CONTEXT:  JSON data, line 1: ...st1", "groups": [ { "database": "", "group": NULL...
-- Databases or clusters referenced several times.
SELECT dist_emaj.dist_emaj_import_clusters_configuration('{ "databases": [ { "database": "db1", "connect_string": "c1", "rollback_parallel_sessions": 1},
                                                                         { "database": "db2", "connect_string": "c2", "rollback_parallel_sessions": 1},
                                                                         { "database": "db1", "connect_string": "c1", "rollback_parallel_sessions": 1} ] }'::JSON);
WARNING:  _import_clusters_conf (1): The JSON structure references several times the database "db1".
ERROR:  _import_clusters_conf: One or several errors have been detected in the supplied JSON structure.
CONTEXT:  PL/pgSQL function dist_emaj._import_clusters_conf(json,text[],text[],boolean,boolean,text) line 56 at RAISE
PL/pgSQL function dist_emaj.dist_emaj_import_clusters_configuration(json,text[],text[],boolean,boolean) line 16 at RETURN
SELECT dist_emaj.dist_emaj_import_clusters_configuration('{ "clusters": [ { "cluster": "clst1", "groups": [ ] },
                                                                          { "cluster": "clst2", "groups": [ ] },
                                                                          { "cluster": "clst1", "groups": [ ] } ]}'::JSON);
WARNING:  _import_clusters_conf (1): The JSON structure references several times the cluster "clst1".
ERROR:  _import_clusters_conf: One or several errors have been detected in the supplied JSON structure.
CONTEXT:  PL/pgSQL function dist_emaj._import_clusters_conf(json,text[],text[],boolean,boolean,text) line 56 at RAISE
PL/pgSQL function dist_emaj.dist_emaj_import_clusters_configuration(json,text[],text[],boolean,boolean) line 16 at RETURN
-- Selected clusters not in the JSON structure.
SELECT dist_emaj.dist_emaj_import_clusters_configuration('{ "clusters": [ { "cluster": "clst1", "groups": [ ] } ]}'::JSON, ARRAY['unknown_1', 'unknown_2']);
WARNING:  _import_clusters_conf (2): The cluster "unknown_1" to import is not referenced in the JSON structure.
WARNING:  _import_clusters_conf (2): The cluster "unknown_2" to import is not referenced in the JSON structure.
ERROR:  _import_clusters_conf: One or several errors have been detected in the JSON groups configuration.
CONTEXT:  PL/pgSQL function dist_emaj._import_clusters_conf(json,text[],text[],boolean,boolean,text) line 80 at RAISE
PL/pgSQL function dist_emaj.dist_emaj_import_clusters_configuration(json,text[],text[],boolean,boolean) line 16 at RETURN
-- Selected clusters already exist.
SELECT dist_emaj.dist_emaj_import_clusters_configuration('{ "clusters": [ { "cluster": "my_cluster", "groups": [ ] } ]}'::JSON, ARRAY['my_cluster'], NULL, FALSE);
WARNING:  _import_clusters_conf (2): The cluster "my_cluster" already exists.
ERROR:  _import_clusters_conf: One or several errors have been detected in the JSON groups configuration.
CONTEXT:  PL/pgSQL function dist_emaj._import_clusters_conf(json,text[],text[],boolean,boolean,text) line 80 at RAISE
PL/pgSQL function dist_emaj.dist_emaj_import_clusters_configuration(json,text[],text[],boolean,boolean) line 16 at RETURN
-- Selected databases not in the JSON structure.
SELECT dist_emaj.dist_emaj_import_clusters_configuration('{ "databases": [ { "database": "db1", "connect_string": "c1", "rollback_parallel_sessions": 1} ] }'::JSON,
                                                         NULL, ARRAY['unknown_1', 'unknown_2']);
WARNING:  _import_clusters_conf (2): The database "unknown_1" to import is not referenced in the JSON structure.
WARNING:  _import_clusters_conf (2): The database "unknown_2" to import is not referenced in the JSON structure.
ERROR:  _import_clusters_conf: One or several errors have been detected in the JSON groups configuration.
CONTEXT:  PL/pgSQL function dist_emaj._import_clusters_conf(json,text[],text[],boolean,boolean,text) line 80 at RAISE
PL/pgSQL function dist_emaj.dist_emaj_import_clusters_configuration(json,text[],text[],boolean,boolean) line 16 at RETURN
-- Selected databases already exist.
SELECT dist_emaj.dist_emaj_import_clusters_configuration('{ "databases": [ { "database": "emaj_1", "connect_string": "c1", "rollback_parallel_sessions": 1} ] }'::JSON,
                                                         NULL, ARRAY['emaj_1'], FALSE);
WARNING:  _import_clusters_conf (2): The database "emaj_1" already exists.
ERROR:  _import_clusters_conf: One or several errors have been detected in the JSON groups configuration.
CONTEXT:  PL/pgSQL function dist_emaj._import_clusters_conf(json,text[],text[],boolean,boolean,text) line 80 at RAISE
PL/pgSQL function dist_emaj.dist_emaj_import_clusters_configuration(json,text[],text[],boolean,boolean) line 16 at RETURN
-- Database referenced by a cluster but does not exist and is no in the JSON configuration.
SELECT dist_emaj.dist_emaj_import_clusters_configuration('{
          "databases": [ { "database": "db1", "connect_string": "cstr1", "rollback_parallel_sessions": 2 }, { "database": "db2", "connect_string": "cstr2", "rollback_parallel_sessions": 3 } ],
          "clusters": [ { "cluster": "clst1", "groups": [ {"database": "db1", "group": "g1"}, {"database": "db3", "group": "g2"} ] } ]
                                                          }'::JSON);
WARNING:  _import_clusters_conf (2): The database "db3" is referenced by at least a cluster. But it does not exist yet and is not to be imported.
ERROR:  _import_clusters_conf: One or several errors have been detected in the JSON groups configuration.
CONTEXT:  PL/pgSQL function dist_emaj._import_clusters_conf(json,text[],text[],boolean,boolean,text) line 80 at RAISE
PL/pgSQL function dist_emaj.dist_emaj_import_clusters_configuration(json,text[],text[],boolean,boolean) line 16 at RETURN
-- OK.
-- Nothing imported because of empty selected clusters and databases arrays.
SELECT dist_emaj.dist_emaj_import_clusters_configuration('{
          "databases": [ { "database": "db1", "connect_string": "cstr1", "rollback_parallel_sessions": 2 } ],
          "clusters": [ { "cluster": "clst1", "groups": [ {"database": "db1", "group": "g1"}, {"database": "db1", "group": "g2"} ] } ]
                                                          }'::JSON, ARRAY[]::TEXT[], ARRAY[]::TEXT[]);
 dist_emaj_import_clusters_configuration 
-----------------------------------------
 No change
(1 row)

-- Create 2 new databases.
SELECT dist_emaj.dist_emaj_import_clusters_configuration('{
          "databases": [ { "database": "new_db1", "connect_string": "cstr1", "rollback_parallel_sessions": 1 },
                         { "database": "new_db2", "connect_string": "cstr2", "rollback_parallel_sessions": 2 } ]
                                                          }'::JSON);
 dist_emaj_import_clusters_configuration 
-----------------------------------------
 Databases: 2 created
(1 row)

SELECT db_name, db_connect_string, db_rlbk_parallel_session, db_creation_time_id, db_last_alter_time_id FROM dist_emaj.dist_emaj_database WHERE db_name LIKE 'new%';
 db_name | db_connect_string | db_rlbk_parallel_session | db_creation_time_id | db_last_alter_time_id 
---------+-------------------+--------------------------+---------------------+-----------------------
 new_db1 | cstr1             |                        1 |                1023 |                      
 new_db2 | cstr2             |                        2 |                1023 |                      
(2 rows)

-- Update both databases (one wit a modified connect string and the other with a modified rollback_parallel_sessions).
SELECT dist_emaj.dist_emaj_import_clusters_configuration('{
          "databases": [ { "database": "new_db1", "connect_string": "modified_cstr1", "rollback_parallel_sessions": 2 },
                         { "database": "new_db2", "connect_string": "cstr2", "rollback_parallel_sessions": 5 } ] }'::JSON, NULL, NULL, TRUE);
 dist_emaj_import_clusters_configuration 
-----------------------------------------
 Databases: 2 updated
(1 row)

SELECT db_name, db_connect_string, db_rlbk_parallel_session, db_creation_time_id, db_last_alter_time_id FROM dist_emaj.dist_emaj_database WHERE db_name LIKE 'new%';
 db_name | db_connect_string | db_rlbk_parallel_session | db_creation_time_id | db_last_alter_time_id 
---------+-------------------+--------------------------+---------------------+-----------------------
 new_db1 | modified_cstr1    |                        2 |                1023 |                  1024
 new_db2 | cstr2             |                        5 |                1023 |                  1024
(2 rows)

-- Create a cluster with a few groups.
SELECT dist_emaj.dist_emaj_import_clusters_configuration('{
          "clusters": [ { "cluster": "new_cluster", "groups": [ {"database": "new_db1", "group": "g1"}, {"database": "new_db2", "group": "g2"} ] } ]
                                                          }'::JSON);
 dist_emaj_import_clusters_configuration 
-----------------------------------------
 Clusters: 1 created
(1 row)

SELECT * FROM dist_emaj.dist_emaj_cluster WHERE clst_name = 'new_cluster';
  clst_name  | clst_creation_time_id | clst_last_alter_time_id 
-------------+-----------------------+-------------------------
 new_cluster |                  1025 |                        
(1 row)

SELECT * FROM dist_emaj.dist_emaj_cluster_group WHERE clgrp_cluster = 'new_cluster' ORDER BY 1, 2, 3;
 clgrp_cluster | clgrp_database | clgrp_group | clgrp_last_assign_time_id 
---------------+----------------+-------------+---------------------------
 new_cluster   | new_db1        | g1          |                      1025
 new_cluster   | new_db2        | g2          |                      1025
(2 rows)

-- Update the cluster with 1 new group and 1 group removed.
SELECT dist_emaj.dist_emaj_import_clusters_configuration('{
          "clusters": [ { "cluster": "new_cluster", "groups": [ {"database": "new_db1", "group": "g1"}, {"database": "new_db2", "group": "g3"} ] } ]
                                                          }'::JSON, NULL, NULL, TRUE);
 dist_emaj_import_clusters_configuration 
-----------------------------------------
 Clusters: 1 updated
(1 row)

SELECT * FROM dist_emaj.dist_emaj_cluster_group WHERE clgrp_cluster = 'new_cluster' ORDER BY 1, 2, 3;
 clgrp_cluster | clgrp_database | clgrp_group | clgrp_last_assign_time_id 
---------------+----------------+-------------+---------------------------
 new_cluster   | new_db1        | g1          |                      1025
 new_cluster   | new_db2        | g3          |                      1026
(2 rows)

--
-- Import from file.
--
-- File does not exist.
SELECT dist_emaj.dist_emaj_import_clusters_configuration('/tmp/dummy/location/file');
ERROR:  could not open file "/tmp/dummy/location/file" for reading: No such file or directory
HINT:  COPY FROM instructs the PostgreSQL server process to read a file. You may want a client-side facility such as psql's \copy.
CONTEXT:  SQL statement "COPY t FROM '/tmp/dummy/location/file'"
PL/pgSQL function dist_emaj.dist_emaj_import_clusters_configuration(text,text[],text[],boolean,boolean) line 21 at EXECUTE
-- Not a JSON format.
\! echo 'not a JSON format' > $EMAJTESTTMPDIR/not_json
SELECT dist_emaj.dist_emaj_import_clusters_configuration(:'EMAJTESTTMPDIR' || '/not_json');
ERROR:  emaj_import_clusters_configuration: The file content is not a valid JSON content.
CONTEXT:  PL/pgSQL function dist_emaj.dist_emaj_import_clusters_configuration(text,text[],text[],boolean,boolean) line 31 at RAISE
-- Import the original configuration. This drops the new_cluster, new_db1 and new_db2 objects.
SELECT dist_emaj.dist_emaj_import_clusters_configuration(:'EMAJTESTTMPDIR' || '/orig_clusters_config_all.JSON', NULL, NULL, TRUE, TRUE);
  dist_emaj_import_clusters_configuration   
--------------------------------------------
 Clusters: 1 dropped / Databases: 2 dropped
(1 row)

-----------------------------
-- Test end: global check.
-----------------------------
SELECT hist_function, hist_event, hist_object, hist_wording, hist_user
  FROM dist_emaj.dist_emaj_hist WHERE hist_id >= 1000 ORDER BY hist_id;
  hist_function  |    hist_event    |       hist_object       |                             hist_wording                             | hist_user 
-----------------+------------------+-------------------------+----------------------------------------------------------------------+-----------
 CREATE_DATABASE | BEGIN            | first_database          |                                                                      | postgres
 CREATE_DATABASE | TIME STAMP SET   | 1000                    |                                                                      | postgres
 CREATE_DATABASE | END              | first_database          | Database created                                                     | postgres
 CREATE_DATABASE | BEGIN            | first_database          |                                                                      | postgres
 CREATE_DATABASE | TIME STAMP SET   | 1001                    |                                                                      | postgres
 CREATE_DATABASE | END              | first_database          | Database modified                                                    | postgres
 DROP_DATABASE   | BEGIN            | dummy_database          |                                                                      | postgres
 DROP_DATABASE   | END              | dummy_database          | The database did not exist                                           | postgres
 DROP_DATABASE   | BEGIN            | first_database          |                                                                      | postgres
 DROP_DATABASE   | TIME STAMP SET   | 1003                    |                                                                      | postgres
 DROP_DATABASE   | END              | first_database          | Database dropped, 1 group assignments deleted                        | postgres
 CREATE_CLUSTER  | BEGIN            | first_cluster           |                                                                      | postgres
 CREATE_CLUSTER  | TIME STAMP SET   | 1004                    |                                                                      | postgres
 CREATE_CLUSTER  | END              | first_cluster           | Cluster created                                                      | postgres
 CREATE_CLUSTER  | BEGIN            | first_cluster           |                                                                      | postgres
 CREATE_CLUSTER  | END              | first_cluster           | The cluster already existed                                          | postgres
 DROP_CLUSTER    | BEGIN            | dummy_cluster           |                                                                      | postgres
 DROP_CLUSTER    | END              | dummy_cluster           | The cluster did not exist                                            | postgres
 DROP_CLUSTER    | BEGIN            | first_cluster           |                                                                      | postgres
 DROP_CLUSTER    | TIME STAMP SET   | 1006                    |                                                                      | postgres
 DROP_CLUSTER    | END              | first_cluster           | Cluster dropped, 1 group assignments deleted                         | postgres
 ASSIGN_GROUP    | BEGIN            | a_database.a_group      | To cluster a_cluster                                                 | postgres
 ASSIGN_GROUP    | TIME STAMP SET   | 1007                    |                                                                      | postgres
 ASSIGN_GROUP    | END              | a_database.a_group      | Group assigned to the cluster                                        | postgres
 ASSIGN_GROUP    | BEGIN            | a_database.a_group      | To cluster a_cluster                                                 | postgres
 ASSIGN_GROUP    | END              | a_database.a_group      | The group was already assigned to the cluster                        | postgres
 REMOVE_GROUP    | BEGIN            | a_database.a_group      | From cluster a_cluster                                               | postgres
 REMOVE_GROUP    | TIME STAMP SET   | 1008                    |                                                                      | postgres
 REMOVE_GROUP    | END              | a_database.a_group      | Group removed from the cluster                                       | postgres
 REMOVE_GROUP    | BEGIN            | a_database.a_group      | From cluster a_cluster                                               | postgres
 REMOVE_GROUP    | END              | a_database.a_group      | The group was not assigned to the cluster                            | postgres
 CREATE_DATABASE | BEGIN            | emaj_1                  |                                                                      | postgres
 CREATE_DATABASE | TIME STAMP SET   | 1009                    |                                                                      | postgres
 CREATE_DATABASE | END              | emaj_1                  | Database created                                                     | postgres
 CREATE_DATABASE | BEGIN            | emaj_2                  |                                                                      | postgres
 CREATE_DATABASE | TIME STAMP SET   | 1010                    |                                                                      | postgres
 CREATE_DATABASE | END              | emaj_2                  | Database created                                                     | postgres
 CREATE_CLUSTER  | BEGIN            | my_cluster              |                                                                      | postgres
 CREATE_CLUSTER  | TIME STAMP SET   | 1011                    |                                                                      | postgres
 CREATE_CLUSTER  | END              | my_cluster              | Cluster created                                                      | postgres
 CREATE_CLUSTER  | BEGIN            | empty_cluster           |                                                                      | postgres
 CREATE_CLUSTER  | TIME STAMP SET   | 1012                    |                                                                      | postgres
 CREATE_CLUSTER  | END              | empty_cluster           | Cluster created                                                      | postgres
 ASSIGN_GROUP    | BEGIN            | emaj_1.myGroup1         | To cluster my_cluster                                                | postgres
 ASSIGN_GROUP    | TIME STAMP SET   | 1013                    |                                                                      | postgres
 ASSIGN_GROUP    | END              | emaj_1.myGroup1         | Group assigned to the cluster                                        | postgres
 ASSIGN_GROUP    | BEGIN            | emaj_1.myGroup2         | To cluster my_cluster                                                | postgres
 ASSIGN_GROUP    | TIME STAMP SET   | 1014                    |                                                                      | postgres
 ASSIGN_GROUP    | END              | emaj_1.myGroup2         | Group assigned to the cluster                                        | postgres
 ASSIGN_GROUP    | BEGIN            | emaj_2.phil's group#3", | To cluster my_cluster                                                | postgres
 ASSIGN_GROUP    | TIME STAMP SET   | 1015                    |                                                                      | postgres
 ASSIGN_GROUP    | END              | emaj_2.phil's group#3", | Group assigned to the cluster                                        | postgres
 ASSIGN_GROUP    | BEGIN            | emaj_2.myGroup4         | To cluster my_cluster                                                | postgres
 ASSIGN_GROUP    | TIME STAMP SET   | 1016                    |                                                                      | postgres
 ASSIGN_GROUP    | END              | emaj_2.myGroup4         | Group assigned to the cluster                                        | postgres
 ASSIGN_GROUP    | BEGIN            | emaj_2.myGroup5         | To cluster my_cluster                                                | postgres
 ASSIGN_GROUP    | TIME STAMP SET   | 1017                    |                                                                      | postgres
 ASSIGN_GROUP    | END              | emaj_2.myGroup5         | Group assigned to the cluster                                        | postgres
 ASSIGN_GROUP    | BEGIN            | emaj_2.myGroup6         | To cluster my_cluster                                                | postgres
 ASSIGN_GROUP    | TIME STAMP SET   | 1018                    |                                                                      | postgres
 ASSIGN_GROUP    | END              | emaj_2.myGroup6         | Group assigned to the cluster                                        | postgres
 CREATE_DATABASE | BEGIN            | no_emaj                 |                                                                      | postgres
 CREATE_DATABASE | TIME STAMP SET   | 1019                    |                                                                      | postgres
 CREATE_DATABASE | END              | no_emaj                 | Database created                                                     | postgres
 IMPORT_CLUSTERS | BEGIN            |                         |                                                                      | postgres
 IMPORT_CLUSTERS | TIME STAMP SET   | 1022                    |                                                                      | postgres
 IMPORT_CLUSTERS | END              |                         | No change                                                            | postgres
 IMPORT_CLUSTERS | BEGIN            |                         |                                                                      | postgres
 IMPORT_CLUSTERS | TIME STAMP SET   | 1023                    |                                                                      | postgres
 IMPORT_CLUSTERS | DATABASE_CREATED | new_db1                 |                                                                      | postgres
 IMPORT_CLUSTERS | DATABASE_CREATED | new_db2                 |                                                                      | postgres
 IMPORT_CLUSTERS | END              |                         | Databases: 2 created                                                 | postgres
 IMPORT_CLUSTERS | BEGIN            |                         |                                                                      | postgres
 IMPORT_CLUSTERS | TIME STAMP SET   | 1024                    |                                                                      | postgres
 IMPORT_CLUSTERS | DATABASE_UPDATED | new_db1                 |                                                                      | postgres
 IMPORT_CLUSTERS | DATABASE_UPDATED | new_db2                 |                                                                      | postgres
 IMPORT_CLUSTERS | END              |                         | Databases: 2 updated                                                 | postgres
 IMPORT_CLUSTERS | BEGIN            |                         |                                                                      | postgres
 IMPORT_CLUSTERS | TIME STAMP SET   | 1025                    |                                                                      | postgres
 IMPORT_CLUSTERS | CLUSTER_CREATED  | new_cluster             |                                                                      | postgres
 IMPORT_CLUSTERS | GROUP_ASSIGNED   | new_db1.g1              | To cluster new_cluster                                               | postgres
 IMPORT_CLUSTERS | GROUP_ASSIGNED   | new_db2.g2              | To cluster new_cluster                                               | postgres
 IMPORT_CLUSTERS | END              |                         | Clusters: 1 created                                                  | postgres
 IMPORT_CLUSTERS | BEGIN            |                         |                                                                      | postgres
 IMPORT_CLUSTERS | TIME STAMP SET   | 1026                    |                                                                      | postgres
 IMPORT_CLUSTERS | GROUP_ASSIGNED   | new_db2.g3              | To cluster new_cluster                                               | postgres
 IMPORT_CLUSTERS | GROUP_REMOVED    | new_db2.g2              | From cluster new_cluster                                             | postgres
 IMPORT_CLUSTERS | END              |                         | Clusters: 1 updated                                                  | postgres
 IMPORT_CLUSTERS | BEGIN            |                         | Input file: '/tmp/emaj_14/create_drop/orig_clusters_config_all.JSON' | postgres
 IMPORT_CLUSTERS | TIME STAMP SET   | 1027                    |                                                                      | postgres
 IMPORT_CLUSTERS | CLUSTER_DROP     | new_cluster             |                                                                      | postgres
 IMPORT_CLUSTERS | DATABASE_DROP    | new_db1                 |                                                                      | postgres
 IMPORT_CLUSTERS | DATABASE_DROP    | new_db2                 |                                                                      | postgres
 IMPORT_CLUSTERS | END              |                         | Clusters: 1 dropped / Databases: 2 dropped                           | postgres
(94 rows)

SELECT time_id, time_event FROM dist_emaj.dist_emaj_time_stamp ORDER BY time_id;
 time_id | time_event 
---------+------------
    1000 | C
    1001 | A
    1003 | D
    1004 | C
    1006 | D
    1007 | A
    1008 | A
    1009 | C
    1010 | C
    1011 | C
    1012 | C
    1013 | A
    1014 | A
    1015 | A
    1016 | A
    1017 | A
    1018 | A
    1019 | C
    1022 | I
    1023 | I
    1024 | I
    1025 | I
    1026 | I
    1027 | I
(24 rows)

-- Remove the temp directory.
\! rm -R $EMAJTESTTMPDIR
