-- create_drop.sql : non regression tests for Distributed E-Maj objects creation and drop
-- It tests in particular:
--   dist_emaj_create_database(), dist_emaj_drop_database(),
--   dist_emaj_create_cluster(), dist_emaj_drop_cluster(),
--   dist_emaj_assign_group(), dist_emaj_remove_group(),
--   dist_emaj_export_clusters_configuration(), dist_emaj_import_clusters_configuration()
--
-- Prepare the test context
--
-- set sequence restart value
select public.handle_dist_emaj_sequences(1000);
 handle_dist_emaj_sequences 
----------------------------
 
(1 row)

-- Define and create the temp file directory to be used by the script.
\setenv EMAJTESTTMPDIR '/tmp/emaj_'`echo $PGVER`'/create_drop'
\set EMAJTESTTMPDIR `echo $EMAJTESTTMPDIR`
\! mkdir -p $EMAJTESTTMPDIR
--
-- Test dist_emaj_create_database()
--
-- illegal value
select dist_emaj.dist_emaj_create_database(null, 'a connect string', 2);
ERROR:  dist_emaj_create_database: The database name can't be NULL or empty.
CONTEXT:  PL/pgSQL function dist_emaj.dist_emaj_create_database(text,text,integer,boolean) line 18 at RAISE
select dist_emaj.dist_emaj_create_database('first_database', null, 2);
ERROR:  dist_emaj_create_database: The connect string can't be NULL.
CONTEXT:  PL/pgSQL function dist_emaj.dist_emaj_create_database(text,text,integer,boolean) line 22 at RAISE
select dist_emaj.dist_emaj_create_database('first_database', 'a connect string', null);
ERROR:  dist_emaj_create_database: The number of rollback parallel sessions must be greater than 0.
CONTEXT:  PL/pgSQL function dist_emaj.dist_emaj_create_database(text,text,integer,boolean) line 26 at RAISE
select dist_emaj.dist_emaj_create_database('first_database', 'a connect string', 0);
ERROR:  dist_emaj_create_database: The number of rollback parallel sessions must be greater than 0.
CONTEXT:  PL/pgSQL function dist_emaj.dist_emaj_create_database(text,text,integer,boolean) line 26 at RAISE
-- ok
select dist_emaj.dist_emaj_create_database('first_database', 'a connect string', 2);
 dist_emaj_create_database 
---------------------------
                         1
(1 row)

select * from dist_emaj.dist_emaj_database where db_name = 'first_database';
    db_name     | db_connect_string | db_rlbk_parallel_session | db_creation_time_id | db_last_alter_time_id 
----------------+-------------------+--------------------------+---------------------+-----------------------
 first_database | a connect string  |                        2 |                1000 |                      
(1 row)

-- already created
select dist_emaj.dist_emaj_create_database('first_database', 'another connect string', 3);
ERROR:  dist_emaj_create_database: The database "first_database" already exists.
CONTEXT:  PL/pgSQL function dist_emaj.dist_emaj_create_database(text,text,integer,boolean) line 36 at RAISE
select dist_emaj.dist_emaj_create_database('first_database', 'another connect string', 3, true);
 dist_emaj_create_database 
---------------------------
                         0
(1 row)

select * from dist_emaj.dist_emaj_database where db_name = 'first_database';
    db_name     |   db_connect_string    | db_rlbk_parallel_session | db_creation_time_id | db_last_alter_time_id 
----------------+------------------------+--------------------------+---------------------+-----------------------
 first_database | another connect string |                        3 |                1000 |                  1001
(1 row)

--
-- Test dist_emaj_drop_database()
--
-- database does not exist.
select dist_emaj.dist_emaj_drop_database('dummy_database');
ERROR:  dist_emaj_drop_database: The database "dummy_database" does not exist.
CONTEXT:  PL/pgSQL function dist_emaj.dist_emaj_drop_database(text,boolean,boolean) line 22 at RAISE
select dist_emaj.dist_emaj_drop_database('dummy_database', true);
 dist_emaj_drop_database 
-------------------------
                       0
(1 row)

-- an assigned group
insert into dist_emaj.dist_emaj_cluster (clst_name) values ('a_cluster');
insert into dist_emaj.dist_emaj_cluster_group values ('a_cluster', 'first_database', 'a group');
-- but CASCADE is not allowed
select dist_emaj.dist_emaj_drop_database('first_database');
ERROR:  dist_emaj_drop_database: The database "first_database" has 1 groups assigned to existing clusters.
CONTEXT:  PL/pgSQL function dist_emaj.dist_emaj_drop_database(text,boolean,boolean) line 37 at RAISE
-- ok, CASCADE is now allowed
select dist_emaj.dist_emaj_drop_database('first_database', false, true);
 dist_emaj_drop_database 
-------------------------
                       1
(1 row)

delete from dist_emaj.dist_emaj_cluster where clst_name = 'a_cluster';
--
-- Test dist_emaj_create_cluster()
--
-- illegal value
select dist_emaj.dist_emaj_create_cluster(null);
ERROR:  dist_emaj_create_cluster: The cluster name can't be NULL or empty.
CONTEXT:  PL/pgSQL function dist_emaj.dist_emaj_create_cluster(text,boolean) line 15 at RAISE
-- ok
select dist_emaj.dist_emaj_create_cluster('first_cluster');
 dist_emaj_create_cluster 
--------------------------
                        1
(1 row)

-- already created
select dist_emaj.dist_emaj_create_cluster('first_cluster');
ERROR:  dist_emaj_create_cluster: The cluster "first_cluster" already exists.
CONTEXT:  PL/pgSQL function dist_emaj.dist_emaj_create_cluster(text,boolean) line 25 at RAISE
select dist_emaj.dist_emaj_create_cluster('first_cluster', true);
 dist_emaj_create_cluster 
--------------------------
                        0
(1 row)

--
-- Test dist_emaj_drop_cluster()
--
-- cluster does not exist.
select dist_emaj.dist_emaj_drop_cluster('dummy_cluster');
ERROR:  dist_emaj_drop_cluster: The cluster "dummy_cluster" does not exist.
CONTEXT:  PL/pgSQL function dist_emaj.dist_emaj_drop_cluster(text,boolean,boolean) line 22 at RAISE
select dist_emaj.dist_emaj_drop_cluster('dummy_cluster', true);
 dist_emaj_drop_cluster 
------------------------
                      0
(1 row)

-- an assigned group
insert into dist_emaj.dist_emaj_database (db_name, db_connect_string, db_rlbk_parallel_session) values ('a_database', 'a connect string', 1);
insert into dist_emaj.dist_emaj_cluster_group values ('first_cluster', 'a_database', 'a group');
-- but CASCADE is not allowed
select dist_emaj.dist_emaj_drop_cluster('first_cluster');
ERROR:  dist_emaj_drop_cluster: The cluster "first_cluster" has 1 groups assigned to it.
CONTEXT:  PL/pgSQL function dist_emaj.dist_emaj_drop_cluster(text,boolean,boolean) line 37 at RAISE
-- ok, CASCADE is now allowed
select dist_emaj.dist_emaj_drop_cluster('first_cluster', false, true);
 dist_emaj_drop_cluster 
------------------------
                      1
(1 row)

delete from dist_emaj.dist_emaj_database where db_name = 'a_database';
--
-- Test dist_emaj_assign_group()
--
insert into dist_emaj.dist_emaj_cluster (clst_name) values ('a_cluster');
insert into dist_emaj.dist_emaj_database (db_name, db_connect_string, db_rlbk_parallel_session) values ('a_database', 'a connect string', 1);
-- invalid values
select dist_emaj.dist_emaj_assign_group('dummy_cluster', 'dummy_database', 'dummy_group');
ERROR:  dist_emaj_assign_group: The cluster "dummy_cluster" does not exist.
CONTEXT:  PL/pgSQL function dist_emaj.dist_emaj_assign_group(text,text,text,boolean) line 20 at RAISE
select dist_emaj.dist_emaj_assign_group('a_cluster', 'dummy_database', 'dummy_group');
ERROR:  dist_emaj_assign_group: The database "dummy_database" does not exist.
CONTEXT:  PL/pgSQL function dist_emaj.dist_emaj_assign_group(text,text,text,boolean) line 29 at RAISE
-- ok
select dist_emaj.dist_emaj_assign_group('a_cluster', 'a_database', 'a_group');
 dist_emaj_assign_group 
------------------------
                      1
(1 row)

-- already assigned
select dist_emaj.dist_emaj_assign_group('a_cluster', 'a_database', 'a_group');
ERROR:  dist_emaj_assign_group: The table group "a_group" on database "a_database" is already assigned to the cluster "a_cluster".
CONTEXT:  PL/pgSQL function dist_emaj.dist_emaj_assign_group(text,text,text,boolean) line 41 at RAISE
select dist_emaj.dist_emaj_assign_group('a_cluster', 'a_database', 'a_group', true);
 dist_emaj_assign_group 
------------------------
                      0
(1 row)

--
-- Test dist_emaj_remove_group()
--
-- invalid values
select dist_emaj.dist_emaj_remove_group('dummy_cluster', 'dummy_database', 'dummy_group');
ERROR:  dist_emaj_remove_group: The cluster "dummy_cluster" does not exist.
CONTEXT:  PL/pgSQL function dist_emaj.dist_emaj_remove_group(text,text,text,boolean) line 20 at RAISE
select dist_emaj.dist_emaj_remove_group('a_cluster', 'dummy_database', 'dummy_group');
ERROR:  dist_emaj_remove_group: The database "dummy_database" does not exist.
CONTEXT:  PL/pgSQL function dist_emaj.dist_emaj_remove_group(text,text,text,boolean) line 29 at RAISE
-- ok
select dist_emaj.dist_emaj_remove_group('a_cluster', 'a_database', 'a_group');
 dist_emaj_remove_group 
------------------------
                      1
(1 row)

-- not assigned group
select dist_emaj.dist_emaj_remove_group('a_cluster', 'a_database', 'a_group');
ERROR:  dist_emaj_remove_group: The table group "a_group" on database "a_database" is not currently assigned to the cluster "a_cluster".
CONTEXT:  PL/pgSQL function dist_emaj.dist_emaj_remove_group(text,text,text,boolean) line 41 at RAISE
select dist_emaj.dist_emaj_remove_group('a_cluster', 'a_database', 'a_group', true);
 dist_emaj_remove_group 
------------------------
                      0
(1 row)

delete from dist_emaj.dist_emaj_database where db_name = 'a_database';
delete from dist_emaj.dist_emaj_cluster where clst_name = 'a_cluster';
--
-- prepare the clusters configuration for the next script.
--
select dist_emaj.dist_emaj_create_database('emaj_1', 'host=localhost port=' || pg_catalog.current_setting('port') || ' dbname=regression_1 user=_regress_emaj_adm password=adm', 2);
 dist_emaj_create_database 
---------------------------
                         1
(1 row)

select dist_emaj.dist_emaj_create_database('emaj_2', 'postgresql://_regress_emaj_adm:adm@localhost:' || pg_catalog.current_setting('port') || '/regression_2', 2);
 dist_emaj_create_database 
---------------------------
                         1
(1 row)

select dist_emaj.dist_emaj_create_cluster('my_cluster');
 dist_emaj_create_cluster 
--------------------------
                        1
(1 row)

select dist_emaj.dist_emaj_create_cluster('empty_cluster');
 dist_emaj_create_cluster 
--------------------------
                        1
(1 row)

select dist_emaj.dist_emaj_assign_group('my_cluster', 'emaj_1', 'myGroup1');
 dist_emaj_assign_group 
------------------------
                      1
(1 row)

select dist_emaj.dist_emaj_assign_group('my_cluster', 'emaj_1', 'myGroup2');
 dist_emaj_assign_group 
------------------------
                      1
(1 row)

select dist_emaj.dist_emaj_assign_group('my_cluster', 'emaj_2', 'phil''s group#3",');
 dist_emaj_assign_group 
------------------------
                      1
(1 row)

select dist_emaj.dist_emaj_assign_group('my_cluster', 'emaj_2', 'myGroup4');
 dist_emaj_assign_group 
------------------------
                      1
(1 row)

select dist_emaj.dist_emaj_assign_group('my_cluster', 'emaj_2', 'myGroup5');
 dist_emaj_assign_group 
------------------------
                      1
(1 row)

select dist_emaj.dist_emaj_assign_group('my_cluster', 'emaj_2', 'myGroup6');
 dist_emaj_assign_group 
------------------------
                      1
(1 row)

--
-- Test dist_emaj_verify_cluster
-- (Note that the distributed rollback states cleanup is tested in the rollback.sql script)
--
-- unknown cluster
select dist_emaj.dist_emaj_verify_cluster('dummy');
ERROR:  dist_emaj_verify_cluster: The cluster "dummy" is unknown.
CONTEXT:  PL/pgSQL function dist_emaj.dist_emaj_verify_cluster(text,boolean) line 23 at RAISE
-- empty cluster
select dist_emaj.dist_emaj_verify_cluster('empty_cluster');
 dist_emaj_verify_cluster 
--------------------------
 
(1 row)

select dist_emaj.dist_emaj_verify_cluster('empty_cluster', TRUE);
ERROR:  dist_emaj_verify_cluster: The cluster "empty_cluster" is empty.
CONTEXT:  PL/pgSQL function dist_emaj.dist_emaj_verify_cluster(text,boolean) line 31 at RAISE
-- emaj is missing in a database
create database regression_no_emaj;
select dist_emaj.dist_emaj_create_database('no_emaj', 'host=localhost port=' || pg_catalog.current_setting('port') || ' dbname=regression_no_emaj user=_regress_emaj_adm password=adm', 1);
 dist_emaj_create_database 
---------------------------
                         1
(1 row)

begin;
  select dist_emaj.dist_emaj_create_cluster('buggy_cluster');
 dist_emaj_create_cluster 
--------------------------
                        1
(1 row)

  select dist_emaj.dist_emaj_assign_group('buggy_cluster', 'no_emaj', 'myGroup1');
 dist_emaj_assign_group 
------------------------
                      1
(1 row)

  select dist_emaj.dist_emaj_verify_cluster('buggy_cluster');
ERROR:  _verify_database (2): Error on database "no_emaj", the emaj extension is not installed in the database.
CONTEXT:  PL/pgSQL function dist_emaj._verify_database(text,text,text,text,boolean) line 54 at RAISE
SQL statement "SELECT dist_emaj._verify_database(db_name, db_connect_string, groups_list, v_dblinkSchema, TRUE)
      FROM (
        SELECT db_name, db_connect_string,
               string_agg(quote_literal(clgrp_group), ',' ORDER BY clgrp_group) AS groups_list
          FROM dist_emaj.dist_emaj_cluster_group
               JOIN dist_emaj.dist_emaj_database ON (dist_emaj_database.db_name = dist_emaj_cluster_group.clgrp_database)
          WHERE clgrp_cluster = p_cluster
          GROUP BY db_name, db_connect_string
          ORDER BY db_name
        ) AS databases"
PL/pgSQL function dist_emaj.dist_emaj_verify_cluster(text,boolean) line 41 at PERFORM
rollback;
-- keep the database and the database for dist_emaj_verify_all() tests in misc.sql
-- should be OK
select dist_emaj.dist_emaj_verify_cluster('my_cluster');
 dist_emaj_verify_cluster 
--------------------------
 
(1 row)

--
-- Check dist_emaj tables content
--
select hist_id, hist_function, hist_event, hist_object, regexp_replace(hist_wording, E'\\d\\d\.\\d\\d\\.\\d\\d\\.\\d\\d\\d\\d', '%', 'g'), hist_user
  from dist_emaj.dist_emaj_hist where hist_id >= 1000 order by 1;
 hist_id |  hist_function  |   hist_event   |       hist_object       |                regexp_replace                 | hist_user 
---------+-----------------+----------------+-------------------------+-----------------------------------------------+-----------
    1004 | CREATE_DATABASE | BEGIN          | first_database          |                                               | postgres
    1005 | CREATE_DATABASE | TIME STAMP SET | 1000                    |                                               | postgres
    1006 | CREATE_DATABASE | END            | first_database          | Database created                              | postgres
    1008 | CREATE_DATABASE | BEGIN          | first_database          |                                               | postgres
    1009 | CREATE_DATABASE | TIME STAMP SET | 1001                    |                                               | postgres
    1010 | CREATE_DATABASE | END            | first_database          | Database modified                             | postgres
    1012 | DROP_DATABASE   | BEGIN          | dummy_database          |                                               | postgres
    1013 | DROP_DATABASE   | END            | dummy_database          | The database did not exist                    | postgres
    1016 | DROP_DATABASE   | BEGIN          | first_database          |                                               | postgres
    1017 | DROP_DATABASE   | TIME STAMP SET | 1003                    |                                               | postgres
    1018 | DROP_DATABASE   | END            | first_database          | Database dropped, 1 group assignments deleted | postgres
    1020 | CREATE_CLUSTER  | BEGIN          | first_cluster           |                                               | postgres
    1021 | CREATE_CLUSTER  | TIME STAMP SET | 1004                    |                                               | postgres
    1022 | CREATE_CLUSTER  | END            | first_cluster           | Cluster created                               | postgres
    1024 | CREATE_CLUSTER  | BEGIN          | first_cluster           |                                               | postgres
    1025 | CREATE_CLUSTER  | END            | first_cluster           | The cluster already existed                   | postgres
    1027 | DROP_CLUSTER    | BEGIN          | dummy_cluster           |                                               | postgres
    1028 | DROP_CLUSTER    | END            | dummy_cluster           | The cluster did not exist                     | postgres
    1031 | DROP_CLUSTER    | BEGIN          | first_cluster           |                                               | postgres
    1032 | DROP_CLUSTER    | TIME STAMP SET | 1006                    |                                               | postgres
    1033 | DROP_CLUSTER    | END            | first_cluster           | Cluster dropped, 1 group assignments deleted  | postgres
    1036 | ASSIGN_GROUP    | BEGIN          | a_database.a_group      | To cluster a_cluster                          | postgres
    1037 | ASSIGN_GROUP    | TIME STAMP SET | 1007                    |                                               | postgres
    1038 | ASSIGN_GROUP    | END            | a_database.a_group      | Group assigned to the cluster                 | postgres
    1040 | ASSIGN_GROUP    | BEGIN          | a_database.a_group      | To cluster a_cluster                          | postgres
    1041 | ASSIGN_GROUP    | END            | a_database.a_group      | The group was already assigned to the cluster | postgres
    1044 | REMOVE_GROUP    | BEGIN          | a_database.a_group      | From cluster a_cluster                        | postgres
    1045 | REMOVE_GROUP    | TIME STAMP SET | 1008                    |                                               | postgres
    1046 | REMOVE_GROUP    | END            | a_database.a_group      | Group removed from the cluster                | postgres
    1048 | REMOVE_GROUP    | BEGIN          | a_database.a_group      | From cluster a_cluster                        | postgres
    1049 | REMOVE_GROUP    | END            | a_database.a_group      | The group was not assigned to the cluster     | postgres
    1050 | CREATE_DATABASE | BEGIN          | emaj_1                  |                                               | postgres
    1051 | CREATE_DATABASE | TIME STAMP SET | 1009                    |                                               | postgres
    1052 | CREATE_DATABASE | END            | emaj_1                  | Database created                              | postgres
    1053 | CREATE_DATABASE | BEGIN          | emaj_2                  |                                               | postgres
    1054 | CREATE_DATABASE | TIME STAMP SET | 1010                    |                                               | postgres
    1055 | CREATE_DATABASE | END            | emaj_2                  | Database created                              | postgres
    1056 | CREATE_CLUSTER  | BEGIN          | my_cluster              |                                               | postgres
    1057 | CREATE_CLUSTER  | TIME STAMP SET | 1011                    |                                               | postgres
    1058 | CREATE_CLUSTER  | END            | my_cluster              | Cluster created                               | postgres
    1059 | CREATE_CLUSTER  | BEGIN          | empty_cluster           |                                               | postgres
    1060 | CREATE_CLUSTER  | TIME STAMP SET | 1012                    |                                               | postgres
    1061 | CREATE_CLUSTER  | END            | empty_cluster           | Cluster created                               | postgres
    1062 | ASSIGN_GROUP    | BEGIN          | emaj_1.myGroup1         | To cluster my_cluster                         | postgres
    1063 | ASSIGN_GROUP    | TIME STAMP SET | 1013                    |                                               | postgres
    1064 | ASSIGN_GROUP    | END            | emaj_1.myGroup1         | Group assigned to the cluster                 | postgres
    1065 | ASSIGN_GROUP    | BEGIN          | emaj_1.myGroup2         | To cluster my_cluster                         | postgres
    1066 | ASSIGN_GROUP    | TIME STAMP SET | 1014                    |                                               | postgres
    1067 | ASSIGN_GROUP    | END            | emaj_1.myGroup2         | Group assigned to the cluster                 | postgres
    1068 | ASSIGN_GROUP    | BEGIN          | emaj_2.phil's group#3", | To cluster my_cluster                         | postgres
    1069 | ASSIGN_GROUP    | TIME STAMP SET | 1015                    |                                               | postgres
    1070 | ASSIGN_GROUP    | END            | emaj_2.phil's group#3", | Group assigned to the cluster                 | postgres
    1071 | ASSIGN_GROUP    | BEGIN          | emaj_2.myGroup4         | To cluster my_cluster                         | postgres
    1072 | ASSIGN_GROUP    | TIME STAMP SET | 1016                    |                                               | postgres
    1073 | ASSIGN_GROUP    | END            | emaj_2.myGroup4         | Group assigned to the cluster                 | postgres
    1074 | ASSIGN_GROUP    | BEGIN          | emaj_2.myGroup5         | To cluster my_cluster                         | postgres
    1075 | ASSIGN_GROUP    | TIME STAMP SET | 1017                    |                                               | postgres
    1076 | ASSIGN_GROUP    | END            | emaj_2.myGroup5         | Group assigned to the cluster                 | postgres
    1077 | ASSIGN_GROUP    | BEGIN          | emaj_2.myGroup6         | To cluster my_cluster                         | postgres
    1078 | ASSIGN_GROUP    | TIME STAMP SET | 1018                    |                                               | postgres
    1079 | ASSIGN_GROUP    | END            | emaj_2.myGroup6         | Group assigned to the cluster                 | postgres
    1080 | CREATE_DATABASE | BEGIN          | no_emaj                 |                                               | postgres
    1081 | CREATE_DATABASE | TIME STAMP SET | 1019                    |                                               | postgres
    1082 | CREATE_DATABASE | END            | no_emaj                 | Database created                              | postgres
(64 rows)

select * from dist_emaj.dist_emaj_cluster order by 1;
   clst_name   | clst_creation_time_id | clst_last_alter_time_id 
---------------+-----------------------+-------------------------
 empty_cluster |                  1012 |                        
 my_cluster    |                  1011 |                    1018
(2 rows)

select * from dist_emaj.dist_emaj_database order by 1;
 db_name |                                   db_connect_string                                    | db_rlbk_parallel_session | db_creation_time_id | db_last_alter_time_id 
---------+----------------------------------------------------------------------------------------+--------------------------+---------------------+-----------------------
 emaj_1  | host=localhost port=5418 dbname=regression_1 user=_regress_emaj_adm password=adm       |                        2 |                1009 |                      
 emaj_2  | postgresql://_regress_emaj_adm:adm@localhost:5418/regression_2                         |                        2 |                1010 |                      
 no_emaj | host=localhost port=5418 dbname=regression_no_emaj user=_regress_emaj_adm password=adm |                        1 |                1019 |                      
(3 rows)

select * from dist_emaj.dist_emaj_cluster_group order by 1,2,3;
 clgrp_cluster | clgrp_database |   clgrp_group    | clgrp_last_assign_time_id 
---------------+----------------+------------------+---------------------------
 my_cluster    | emaj_1         | myGroup1         |                      1013
 my_cluster    | emaj_1         | myGroup2         |                      1014
 my_cluster    | emaj_2         | myGroup4         |                      1016
 my_cluster    | emaj_2         | myGroup5         |                      1017
 my_cluster    | emaj_2         | myGroup6         |                      1018
 my_cluster    | emaj_2         | phil's group#3", |                      1015
(6 rows)

-----------------------------
-- dist_emaj_export_clusters_configuration() and dist_emaj_import_clusters_configuration() tests.
-----------------------------
--
-- Direct export.
--
--   Bad selected clusters array.
SELECT dist_emaj.dist_emaj_export_clusters_configuration(ARRAY['my_cluster', 'unknown1', 'unknown2']);
ERROR:  _export_clusters_conf: The clusters unknown1, unknown2 are unknown.
CONTEXT:  PL/pgSQL function dist_emaj._export_clusters_conf(text[]) line 32 at RAISE
PL/pgSQL function dist_emaj.dist_emaj_export_clusters_configuration(text[]) line 8 at RETURN
-- Ok.
SELECT json_array_length(dist_emaj.dist_emaj_export_clusters_configuration()->'clusters');
 json_array_length 
-------------------
                 2
(1 row)

SELECT json_array_length(dist_emaj.dist_emaj_export_clusters_configuration()->'databases');
 json_array_length 
-------------------
                 2
(1 row)

SELECT json_array_length(dist_emaj.dist_emaj_export_clusters_configuration(ARRAY['my_cluster', 'empty_cluster'])->'clusters');
 json_array_length 
-------------------
                 2
(1 row)

--
-- Export to a file.
--
--   Error.
SELECT dist_emaj.dist_emaj_export_clusters_configuration('/tmp/dummy/location/file');
ERROR:  could not open file "/tmp/dummy/location/file" for writing: No such file or directory
HINT:  COPY TO instructs the PostgreSQL server process to write a file. You may want a client-side facility such as psql's \copy.
CONTEXT:  SQL statement "COPY t TO '/tmp/dummy/location/file'"
PL/pgSQL function dist_emaj.dist_emaj_export_clusters_configuration(text,text[]) line 17 at EXECUTE
--   Ok.
SELECT dist_emaj.dist_emaj_export_clusters_configuration(:'EMAJTESTTMPDIR' || '/orig_clusters_config_all.json');
 dist_emaj_export_clusters_configuration 
-----------------------------------------
                                       2
(1 row)

SELECT dist_emaj.dist_emaj_export_clusters_configuration(:'EMAJTESTTMPDIR' || '/orig_clusters_config_partial.json', ARRAY['my_cluster']);
 dist_emaj_export_clusters_configuration 
-----------------------------------------
                                       1
(1 row)

\! wc -l $EMAJTESTTMPDIR/*.json
  52 /tmp/emaj_18/create_drop/orig_clusters_config_all.json
  47 /tmp/emaj_18/create_drop/orig_clusters_config_partial.json
  99 total
\! grep -v ', at ' $EMAJTESTTMPDIR/orig_clusters_config_all.json
{
  "databases": [
    {
      "database": "emaj_1",
      "connect_string": "host=localhost port=5418 dbname=regression_1 user=_regress_emaj_adm password=adm",
      "rollback_parallel_sessions": 2
    },
    {
      "database": "emaj_2",
      "connect_string": "postgresql://_regress_emaj_adm:adm@localhost:5418/regression_2",
      "rollback_parallel_sessions": 2
    }
  ],
  "clusters": [
    {
      "cluster": "empty_cluster",
      "groups": [
      ]
    },
    {
      "cluster": "my_cluster",
      "groups": [
        {
          "database": "emaj_1",
          "group": "myGroup1"
        },
        {
          "database": "emaj_1",
          "group": "myGroup2"
        },
        {
          "database": "emaj_2",
          "group": "myGroup4"
        },
        {
          "database": "emaj_2",
          "group": "myGroup5"
        },
        {
          "database": "emaj_2",
          "group": "myGroup6"
        },
        {
          "database": "emaj_2",
          "group": "phil's group#3\\","
        }
      ]
    }
  ]
}

-- Remove the temp directory.
\! rm -R $EMAJTESTTMPDIR
