-- viewer.sql : test dist_emaj data access and functions calls by a dist_emaj_viewer role
--
-- do not display DETAIL and CONTEXT outputs when an error is raised (\errverbose can be used to debug a statement)
\set VERBOSITY terse
--
-- Prepare the test context
--
-- set sequence restart value
select public.handle_dist_emaj_sequences(5000);
 handle_dist_emaj_sequences 
----------------------------
 
(1 row)

set session_authorization to _regress_dist_emaj_viewer;
-----------------------------
-- authorized table or view accesses
-----------------------------
select 'select ok' as result from (select count(*) from dist_emaj.dist_emaj_hist) as t;
  result   
-----------
 select ok
(1 row)

select 'select ok' as result from (select count(*) from dist_emaj.dist_emaj_all_param) as t;
  result   
-----------
 select ok
(1 row)

select 'select ok' as result from (select count(*) from dist_emaj.dist_emaj_hist) as t;
  result   
-----------
 select ok
(1 row)

select 'select ok' as result from (select count(*) from dist_emaj.dist_emaj_time_stamp) as t;
  result   
-----------
 select ok
(1 row)

select 'select ok' as result from (select count(*) from dist_emaj.dist_emaj_cluster) as t;
  result   
-----------
 select ok
(1 row)

select 'select ok' as result from (select count(*) from dist_emaj.dist_emaj_cluster_group) as t;
  result   
-----------
 select ok
(1 row)

select 'select ok' as result from (select count(*) from dist_emaj.dist_emaj_mark) as t;
  result   
-----------
 select ok
(1 row)

select 'select ok' as result from (select count(*) from dist_emaj.dist_emaj_mark_database) as t;
  result   
-----------
 select ok
(1 row)

select 'select ok' as result from (select count(*) from dist_emaj.dist_emaj_rlbk) as t;
  result   
-----------
 select ok
(1 row)

select 'select ok' as result from (select count(*) from dist_emaj.dist_emaj_rlbk_database) as t;
  result   
-----------
 select ok
(1 row)

-----------------------------
-- forbiden table accesses (just test 1 delete)
-----------------------------
delete from dist_emaj.dist_emaj_hist;
ERROR:  permission denied for table dist_emaj_hist
-----------------------------
-- dist_emaj_database specific case
-----------------------------
-- authorized
select 'select ok' as result from (select count(*) from dist_emaj.dist_emaj_database) as t;
  result   
-----------
 select ok
(1 row)

select db_name, db_rlbk_parallel_session from dist_emaj.dist_emaj_database order by 1;
 db_name | db_rlbk_parallel_session 
---------+--------------------------
 emaj_1  |                        2
 emaj_2  |                        2
(2 rows)

select clst_name, db_name, db_rlbk_parallel_session, db_groups_array from dist_emaj.dist_emaj_database_aggregates order by 1, 2;
 clst_name  | db_name | db_rlbk_parallel_session |                 db_groups_array                  
------------+---------+--------------------------+--------------------------------------------------
 my_cluster | emaj_1  |                        2 | {myGroup1,myGroup2}
 my_cluster | emaj_2  |                        2 | {myGroup4,myGroup5,myGroup6,"phil's group#3\","}
(2 rows)

-- forbidden
select * from dist_emaj.dist_emaj_database;
ERROR:  permission denied for table dist_emaj_database
delete from dist_emaj.dist_emaj_database;
ERROR:  permission denied for table dist_emaj_database
select * from dist_emaj.dist_emaj_database_aggregates;
ERROR:  permission denied for view dist_emaj_database_aggregates
-----------------------------
-- authorized functions
-----------------------------
select dist_emaj.dist_emaj_get_version();
 dist_emaj_get_version 
-----------------------
 <devel>
(1 row)

-----------------------------
-- forbiden functions (just test 1)
-----------------------------
select dist_emaj.dist_emaj_verify_cluster('my_cluster');
ERROR:  permission denied for function dist_emaj_verify_cluster
--
reset session_authorization;
