-- viewer.sql : test dist_emaj data access and functions calls by a dist_emaj_viewer role.
--
-- Do not display DETAIL and CONTEXT outputs when an error is raised (\errverbose can be used to debug a statement).
\set VERBOSITY terse
--
-- Prepare the test context.
--
-- Set sequence restart value.
SELECT public.handle_dist_emaj_sequences(5000);
 handle_dist_emaj_sequences 
----------------------------
 
(1 row)

SET session_authorization TO _regress_dist_emaj_viewer;
-----------------------------
-- Authorized table or view accesses.
-----------------------------
SELECT 'SELECT ok' AS result FROM (SELECT count(*) FROM dist_emaj.dist_emaj_hist) AS t;
  result   
-----------
 SELECT ok
(1 row)

SELECT 'SELECT ok' AS result FROM (SELECT count(*) FROM dist_emaj.dist_emaj_all_param) AS t;
  result   
-----------
 SELECT ok
(1 row)

SELECT 'SELECT ok' AS result FROM (SELECT count(*) FROM dist_emaj.dist_emaj_hist) AS t;
  result   
-----------
 SELECT ok
(1 row)

SELECT 'SELECT ok' AS result FROM (SELECT count(*) FROM dist_emaj.dist_emaj_time_stamp) AS t;
  result   
-----------
 SELECT ok
(1 row)

SELECT 'SELECT ok' AS result FROM (SELECT count(*) FROM dist_emaj.dist_emaj_cluster) AS t;
  result   
-----------
 SELECT ok
(1 row)

SELECT 'SELECT ok' AS result FROM (SELECT count(*) FROM dist_emaj.dist_emaj_cluster_group) AS t;
  result   
-----------
 SELECT ok
(1 row)

SELECT 'SELECT ok' AS result FROM (SELECT count(*) FROM dist_emaj.dist_emaj_mark) AS t;
  result   
-----------
 SELECT ok
(1 row)

SELECT 'SELECT ok' AS result FROM (SELECT count(*) FROM dist_emaj.dist_emaj_mark_database) AS t;
  result   
-----------
 SELECT ok
(1 row)

SELECT 'SELECT ok' AS result FROM (SELECT count(*) FROM dist_emaj.dist_emaj_rlbk) AS t;
  result   
-----------
 SELECT ok
(1 row)

SELECT 'SELECT ok' AS result FROM (SELECT count(*) FROM dist_emaj.dist_emaj_rlbk_database) AS t;
  result   
-----------
 SELECT ok
(1 row)

-----------------------------
-- Forbiden table accesses (just test 1 delete).
-----------------------------
DELETE FROM dist_emaj.dist_emaj_hist;
ERROR:  permission denied for table dist_emaj_hist
-----------------------------
-- Dist_emaj_database specific case.
-----------------------------
-- Authorized.
SELECT 'SELECT ok' AS result FROM (SELECT count(*) FROM dist_emaj.dist_emaj_database) AS t;
  result   
-----------
 SELECT ok
(1 row)

SELECT db_name, db_rlbk_parallel_session FROM dist_emaj.dist_emaj_database ORDER BY 1;
 db_name | db_rlbk_parallel_session 
---------+--------------------------
 emaj_1  |                        2
 emaj_2  |                        2
(2 rows)

SELECT clst_name, db_name, db_rlbk_parallel_session, db_groups_array FROM dist_emaj.dist_emaj_database_aggregates ORDER BY 1, 2;
 clst_name  | db_name | db_rlbk_parallel_session |                 db_groups_array                  
------------+---------+--------------------------+--------------------------------------------------
 my_cluster | emaj_1  |                        2 | {myGroup1,myGroup2}
 my_cluster | emaj_2  |                        2 | {myGroup4,myGroup5,myGroup6,"phil's group#3\","}
(2 rows)

-- Forbidden.
SELECT * FROM dist_emaj.dist_emaj_database;
ERROR:  permission denied for table dist_emaj_database
DELETE FROM dist_emaj.dist_emaj_database;
ERROR:  permission denied for table dist_emaj_database
SELECT * FROM dist_emaj.dist_emaj_database_aggregates;
ERROR:  permission denied for view dist_emaj_database_aggregates
-----------------------------
-- Authorized functions.
-----------------------------
SELECT dist_emaj.dist_emaj_get_version();
 dist_emaj_get_version 
-----------------------
 <devel>
(1 row)

-----------------------------
-- Forbiden functions (just test 1).
-----------------------------
SELECT dist_emaj.dist_emaj_verify_cluster('my_cluster');
ERROR:  permission denied for function dist_emaj_verify_cluster
--
RESET session_authorization;
